{
  "schema_version": "starlight.runtime_planning_policy.v2",
  "policy_id": "queen-workflow-policy-v2",
  "budget_policy_id": "starlight-platform-pilot-budget-v1",
  "max_daily_cost_usd": 25,
  "team_profile_source": {
    "repository": "frankxai/starlight-swarm",
    "commit_sha": "f7aa7f8cefd2c42bf91c97de89fcb09fcae8621c",
    "path": "runtime/examples/starlight-platform-team.b12e904.profile.json"
  },
  "eve_allowlisted_workload_ids": [],
  "allowed_runtimes": [
    "cloudflare-workflows",
    "vercel-workflow",
    "railway-worker",
    "hermes-local",
    "n8n-integration"
  ],
  "deferred_runtimes": [],
  "activation_mode": "dry-run-only",
  "review_date": "2026-10-04",
  "workflow_ownership": [
    {
      "workflow_id": "creator-engineering",
      "workload_scope": "agent-centric",
      "identity_state_owner": "cloudflare",
      "durable_engine": "cloudflare-workflows"
    }
  ]
}
